{
  "schema_version":"1.0.0",
  "arm_id":"arm-f24",
  "platform":"Penpot MCP",
  "version":"2.15.0",
  "listener":{"host":"127.0.0.1","port":4401,"inspection_command":"lsof -nP -iTCP:4401 -sTCP:LISTEN","inspection_output":"COMMAND PID USER FD TYPE DEVICE SIZE/OFF NODE NAME\nnode 123 runner 18u IPv4 0x0 0t0 TCP 127.0.0.1:4401 (LISTEN)","inspection_output_sha256":"bad7035e4f534d3dacf96f5895501ecd9ac64aea329e9e2eafe924a72c174634"},
  "public_listener_detected":false,
  "zero_cost_receipt_sha256":"bbbbbbbbbbbbbbbbbbbbbbbbbbbbbbbbbbbbbbbbbbbbbbbbbbbbbbbbbbbbbbbb",
  "canvas_locator":"runs/arm-f24/C6/r1/canvas.penpot",
  "canvas_sha256":"cccccccccccccccccccccccccccccccccccccccccccccccccccccccccccccccc",
  "checked_at_utc":"2026-09-09T00:00:00Z",
  "checker":"operations-reviewer"
}
